category;tweet_id;text;date;retweet_count;geo;coordinates;place_id;place_centroid;place_country;place_country_code;place_full_name;place_name;place_type
of;1.15595E+18;*@ChocolateJ15 Amen thank you. God bless you and your family with the love of God;7/29/2019 21:05;0;;;;;;;;;
of;1.15595E+18;Nigeria has been categorised into two most dangerous terrorist organizations in the world namely:  Being a country of brutes and a place where murderers are rewarded handsomely while the innocent are jailed, killed or tagged terrorist by the government. -----Family Writers Press;7/29/2019 21:05;0;;;;;;;;;
of;1.15595E+18;*enjoyed at home because a glass of whatever liquor in downtown is 💸;7/29/2019 21:05;0;;;;;;;;;
of;1.15595E+18;*@CMOMaharashtra *@Dev_Fadnavis *@mieknathshinde Ppl want bridge in shilphata,ppl want metro from dombivali to Mahape .You are busy in different inauguration.BJP/Sena seems to loosing pulse of ppl?;7/29/2019 21:05;0;;;;;;;;;
of;1.15595E+18;"*@jockneycab *@TX1Fan *@MPSRTPC *@TfLTPH *@MPSHammFul There was of course GB's ""losing"" their badges &amp  upon requesting replacement GB,  it was just sold to their YB buddy for a neat sum. both end up in win win situation as CO's hardly bother stopping blackcabs. this one only got caught due to a defective break light.";7/29/2019 21:05;0;;;;;;;;;
of;1.15595E+18;New Episode of the Black 2 Randomized Nuzlocke Hope you guys enjoy it *@NavyRed11 *@Vecho0 *@UnitedHayze *@Vinny *@GameboyLuke;7/29/2019 21:05;0;;;;;;;;;
of;1.15595E+18;"This was one of the most interesting podcast episodes I’ve listened to.  From history to politics, sports and entertainment.  Dr. West delivered. 

https://t.co/aWdrOtYoYw

#Respect #JRE https://t.co/DaCaPtgg03";7/29/2019 21:05;0;;;;;;;;;
of;1.15595E+18;*@kcbaskin *@BostonGlobe By a remarkable coincidence, that's what houseguests of people who have shark tank aquariums in their home are saying, but louder, and higher-pitched.;7/29/2019 21:05;0;;;;;;;;;
of;1.15595E+18;Kindness doesn’t work on bitter/mean people. Distance does. Create as much space between you and those types of people as you can.;7/29/2019 21:05;0;;;;;;;;;
of;1.15595E+18;day 16717 of thinking queen elizabeth is ugly as fuuuck;7/29/2019 21:05;0;;;;;;;;;
of;1.15595E+18;UN News With Libyans now ‘fighting the wars of others’ inside their own country, UN envoy urges Security Council action to end violence https://t.co/ak3k0I4LiK https://t.co/rusU1qdYuW https://t.co/QCmZVjKzL1;7/29/2019 21:05;0;;;;;;;;;
of;1.15595E+18;quote for a screen recording of ur acc;7/29/2019 21:05;0;;;;;;;;;
of;1.15595E+18;*@Tcat29979418 *@JefPrice and it doesn't say how to be a good consumer of statistics, it says to question everything, but hey, that just proves that you didn't even bother to read it LOLOLOL https://t.co/9HZp1TMBE2;7/29/2019 21:05;0;;;;;;;;;
of;1.15595E+18;*@ashleyiaco The last two weddings I went to both had everyone give the speeches at the rehearsal dinner. Both my maid of honor and my father stressed through my entire wedding and reception dinner about their speeches. They were both a nervous wreck!;7/29/2019 21:05;0;;;;;;;;;
of;1.15595E+18;"omg hierarchized, continuous and functional  teeming with powerful imaginaries that collectively The future is queerness’s
domain By means of such surveillance, dis­ ciplinary power became";7/29/2019 21:05;0;;;;;;;;;
of;1.15595E+18;[hacker voice] sometimes the train of destiny makes very large pit stops;7/29/2019 21:05;0;;;;;;;;;
of;1.15595E+18;*@World_Of_Hurt *@ewarren *@TheRevAl *@World_Of_Butt_Hurt   *fixed;7/29/2019 21:05;0;;;;;;;;;
of;1.15595E+18;Do you lot not understand the meaning of the word minority? Even if every black person in the UK voted it wouldn’t matter 😄;7/29/2019 21:05;0;;;;;;;;;
of;1.15595E+18;*@cbh8673 *@WFAN660 He has like the second best ERA of our starters.;7/29/2019 21:05;0;;;;;;;;;
of;1.15595E+18;All of them https://t.co/PsuKYEcg1Q;7/29/2019 21:05;0;;;;;;;;;
of;1.15595E+18;*@PilotFlyingJ No apology needed. Your corporate stores are 👍🏻👍🏻, some of the affiliates need a 🔥 lit under them.;7/29/2019 21:05;0;;;;;;;;;
of;1.15595E+18;Finally, to everyone in the best damn design community I am honoured to be a part of, you know who you are - Triangles forever.;7/29/2019 21:05;0;;;;;;;;;
of;1.15595E+18;The Netflix investigative documentary “The Great Hack” is a must see for everyone, to open your eyes to the revelation of data profiling and how its being used to manipulate us. https://t.co/tL1BCUzqTt;7/29/2019 21:05;0;;;;;;;;;
of;1.15595E+18;"*@FigmentPudding *@UrsulaV Do it
We need all the support we can get
... and feeling helpless and stupid is just part of the package
I(Also, it's okay to curl up in a fetal position and weep from time to time, as needed.)";7/29/2019 21:05;0;;;;;;;;;
of;1.15595E+18;Sweet dad of mine, I will cherish moments like this forever 💓 https://t.co/zITbdh4m5S;7/29/2019 21:05;0;;;;;;;;;
of;1.15595E+18;Blisters on the inside and outside of the mouth and blisters on the hand and foot , and you can get a fever https://t.co/2ZeVQk6YAu;7/29/2019 21:05;0;;;;;;;;;
of;1.15595E+18;Dota Underlords finally let me connect to steam after like a week and a half of not working and now I’m finally trying it out. I don’t understand anything but I can get 50 gold and just Econ forever so that’s cool;7/29/2019 21:05;0;;;;;;;;;
of;1.15595E+18;*@ImpeachTrump012 *@realDonaldTrump Nope. Just over 33,000 deaths by gun in US per year. Of those, 10,000 of those are murders. That is about 0.00003% of the total people in the US. Stop appealing to emotions and pay attention to real statistics.;7/29/2019 21:05;0;;;;;;;;;
of;1.15595E+18;I’ve never had a problem with adapting but Cape Town weather makes it difficult to study or even function in general, when you think of stepping out the house jerrr mental warfare.;7/29/2019 21:05;0;;;;;;;;;
of;1.15595E+18;"YO *@BigHitEnt , PLEASE ADOPT THE WHOLE OF NCT!! 
https://t.co/ParLPMPh69";7/29/2019 21:05;0;;;;;;;;;
of;1.15595E+18;"*@OcheBalboa1 *@hazelglasgow *@cghgreen The words, in and of themselves, are English.

The order? Nonsense.

I blame the schools.";7/29/2019 21:05;0;;;;;;;;;
of;1.15595E+18;"*@InspiringU2 *@HuffPostPol Now you speak out or disagree and Repubs want to send you out of the country or back to 'your country'.
Did the conservatives get the same response under the Obama administration?
The rhetoric on the right is total intolerance and they feel entitled to act like Nazis.";7/29/2019 21:05;0;;;;;;;;;
of;1.15595E+18;*@DrFishSG My thought was something like a rat king except a mass of lamprey. But it was called a bear pit for some reason.;7/29/2019 21:05;0;;;;;;;;;
of;1.15595E+18;India only chose Ovie to take him home to do an episode of BLACKED;7/29/2019 21:05;0;;;;;;;;;
of;1.15595E+18;*@DanaPerino Everybody’s a big favor go back on vacation trying to make sense out of what you say is like watching grass grow!;7/29/2019 21:05;0;;;;;;;;;
of;1.15595E+18;*@Freekeith *@JerrelXL *@Byrons360 *@FahimInsurance *@AJTheManChild *@SquareBidness *@knickanator *@Trace_AVP *@LooseJointny *@TruePG718 *@Woodshed_1914 *@TMal761 *@2ForgetUs *@Knickstape2005 *@Chuck1one *@sowatdascenario *@BigFreezie *@RTaylor2283 *@elr3yd3rd *@KeepClmStayMe7o *@Ant4418 *@Jaelin_Taylor *@stalling_e *@rahmmagick *@0oty_Mac *@DonaldP47082631 *@NYCDebo *@net_steven *@MacksJulien *@ed_tsunoda *@Rick__War *@Leo_The_2nd *@IanChisolm *@eski225 *@Marxman35 *@shwinnypooh *@PreZnyc621 *@MrAlexCollins *@_CK2K *@ShuaibA12 *@PennStateThor *@BX2GROSS *@zion_mvp *@stateofthenewy1 *@racerbluegold *@Knickaveli *@KnaledgeNC *@NoActionJackson *@Btruetolife *@ginisangpepe Can't even blame Jigga. In the 90s the Knicks were literally a BROOKLYN team in terms of demeanor and style. They really represented the borough. But Jigga had a chance to go where no rapper had gone before. Bigger than sports for him.;7/29/2019 21:05;0;;;;;;;;;
of;1.15595E+18;Ho many of these witches are actually biological males? More than a few...;7/29/2019 21:05;0;;;;;;;;;
of;1.15595E+18;Wow thanks... lol well I know one of the votes was meant for 2 https://t.co/0zfKj88tXy;7/29/2019 21:05;0;;;;;;;;;
of;1.15595E+18;*@Synthyaesor *@JoeyCrypto420 It's not a paradox.  If you look at a billiard ball under a microscope, then it is actually thousands of times more bumpy than the earth. So measuring it's circumference like that would also make it huge;7/29/2019 21:05;0;;;;;;;;;
of;1.15595E+18;*@RadiosMisfits *@StaceyPrussman *@angelaril2 *@thecreepfest I got called a cuck. And that helped me realise that insults on twitter hurt less if I dont know what the definition of the insults.;7/29/2019 21:05;0;;;;;;;;;
of;1.15595E+18;*@theanchoredblog *@NomadWriting We do and it is great getting out of Toronto to the US.  Otherwise it is a HUGE wait!;7/29/2019 21:05;0;;;;;;;;;
of;1.15595E+18;*@FuriousFinnPRO *@NPiratey *@Xbox *@growtopiagame Haha agree. Everyone says season 2 is best. After season 3 it's just gone stupid. Should of kept the game the same and just added more buildings into the map and stop with this stupid story each season. *@EpicGames *@FortniteGame;7/29/2019 21:05;0;;;;;;;;;
of;1.15595E+18;Maybe cos he’s head of house? Does  the head of house get immunity? It’s how Diane has never been up for eviction that beaten me.  She’s quite forgettable to me. To me o. My opinion- before y’all come for me 😊 https://t.co/7xdyR26Awn;7/29/2019 21:05;0;;;;;;;;;
of;1.15595E+18;*@alexwickham A few unemployed degenerates, angling for a glimpse of Saint Nickla are not representative of Scotland.;7/29/2019 21:05;0;;;;;;;;;
of;1.15595E+18;*@IngrahamAngle *@SpeakerPelosi Pelosi can’t hide from Trump anymore! She’s a complete and utter disgrace! She flip flops back and forth continually. The American people are wise to her bag of tricks now! Trump forever! He will easily win in 2020 as the Dems have NO ONE with any brain power to oppose him! Fact!;7/29/2019 21:05;0;;;;;;;;;
of;1.15595E+18;out of ALL the damn love songs yugyeom why 😭😭😭 jdjdjs https://t.co/rzK97j9S4e;7/29/2019 21:05;0;;;;;;;;;
of;1.15595E+18;Celtic fan and a Spurs fan.  Wouldn’t mind Danny Welbeck on a free.  It’s because of fans like you we don’t deserve anything relatively nice https://t.co/cmrtpnt14B;7/29/2019 21:05;0;;;;;;;;;
of;1.15595E+18;Well I am irked too! #MoscowMitch *@senatemajldr pass the bills to protect our elections stop blaming democrats because the only way you can win is by cheating! Russia has your number but the American people will not stand for any of this! https://t.co/5NmhELCCu7;7/29/2019 21:05;0;;;;;;;;;
of;1.15595E+18;*@RashidaTlaib Frustratingly (a word?), it seems the Democratic members of Congress are very sharp at aiming words for their election advantage.  Beyond words, however, nada.  That's while the fascists are changing the very structure of society.;7/29/2019 21:05;0;;;;;;;;;
of;1.15595E+18;Today we talk #SPN s.13 eps 2 &amp  3. There's a new Prince of Hell in town Asmodeus(*@JeffreyVParise), Missouri Mosley has a hunt for Dean &amp  Jody, &amp  we meet her granddaughter Patience (*@ClarkBacko). As always our admiration for *@kimrhodes4real gets 15 minutes. https://t.co/WQFGIzwlWR;7/29/2019 21:05;0;;;;;;;;;
of;1.15595E+18;*@maidensblade *@mel_thegreat I know I've had a long day, but did I forget the definition of mutually exclusive?;7/29/2019 21:05;0;;;;;;;;;
of;1.15595E+18;*@JoricGaming Bro the honor is all mine! I am in such a place of gratitude when it comes to how much of a mentor, a friend and a down right good salt of the earth guy. I have and always will support you my good friend. You sir ARE deserving! 💙😎;7/29/2019 21:05;0;;;;;;;;;
of;1.15595E+18;If your highlight of this entire 8 weeks wasnt When Maura shouted ‘what did you think, I was gonna suck yer off?’ then you are wrong #loveisland;7/29/2019 21:05;0;;;;;;;;;
of;1.15595E+18;I have no shame!! I spent 75 dollars on 3 Funko Pops of Eleven, from *@Stranger_Things Honestly it is my favourite show ever!! https://t.co/fN9AT9jeFT;7/29/2019 21:05;0;;;;;;;;;
of;1.15595E+18;Level of loyalty;7/29/2019 21:05;0;;;;;;;;;
of;1.15595E+18;GSA’s Office of Small Business Utilization will hold a series of webinars to help small business owners contract with the federal government. https://t.co/kjow9TCVRF;7/29/2019 21:05;0;;;;;;;;;
of;1.15595E+18;I dunno how to convey to a mob of people who only kinda know me and currently hate me that these are the only two zones I have ever been brought up to know? It just feels like you're using your trauma as an excuse right?;7/29/2019 21:05;0;;;;;;;;;
of;1.15595E+18;Solo game TEAMING CHEATERS Both got out of new vehicle and same clothes  #PLAYERUNKNOWNSBATTLEGROUNDS #XboxShare https://t.co/WLcZzMij3o;7/29/2019 21:05;0;;;;;;;;;
of;1.15595E+18;"*@YMcglaun No, that's not what I meant.
The argument from ignorance is a fallacious form of argument.
Basically, 'if you cant answer a question, then whatever bullshit I pull out of my arse MUST be the answer.'
It is often used by religious apologists.";7/29/2019 21:05;0;;;;;;;;;
of;1.15595E+18;*@clcmuses 7 DAYS WHAT RYPE OF THREAT NFNDNDNDDN;7/29/2019 21:05;0;;;;;;;;;
of;1.15595E+18;I am more than a little happy to share that at today's weekly weigh-in I am down 30 pounds since the middle of May. (Wish me luck on those last 10 pounds to reach my goal!);7/29/2019 21:05;0;;;;;;;;;
of;1.15595E+18;*@husnaali99 This video of my bias as center;7/29/2019 21:05;0;;;;;;;;;
of;1.15595E+18;"Maybe you wrong enough 
They are warrior's butt they all speak for money nothing else they can't beat us bcz we are not darbaris we have pure faith with full wisdom on our leader we don't want fame nor we have greed of money or some kind of protocol 

*@MaryamNSharif 
#exposepmln https://t.co/MJTpmHTNY0";7/29/2019 21:05;0;;;;;;;;;
of;1.15595E+18;another copy of Madame X has arrived 😭😂 with a limited promo key chain 😍 gonna turn it into a necklace 🙌🏼🙌🏼🔥👍🏼🕺🏼✨ *@Madonna https://t.co/4K5HBS49wT;7/29/2019 21:05;0;;;;;;;;;
of;1.15595E+18;It will be harder to make a cut on the PGA Tour next season as the number of players allowed to play during the final two days of a tournament will be reduced from 70 and ties to the top… https://t.co/wndYQkKJay https://t.co/jCcWxthpOC;7/29/2019 21:05;0;;;;;;;;;
of;1.15595E+18;get out this memories of my mind it's killing me;7/29/2019 21:05;0;;;;;;;;;
of;1.15595E+18;*@_bluntsnblondes *@BassCanyon *@cult_of_rezz *@MacallRoss *@gavin_bailey13 *@Pirate_Jacob_;7/29/2019 21:05;0;;;;;;;;;
of;1.15595E+18;Call it what you will but in my book, canceling my gym membership and immediately coming home and using the cold two cups of coffee in the pot from this morning to make myself an iced latte while watching dog videos is self care;7/29/2019 21:05;0;;;;;;;;;
of;1.15595E+18;I’m so emotional rn watching the love island final as if I haven’t missed two weeks of the show;7/29/2019 21:05;0;;;;;;;;;
of;1.15595E+18;South of #Thailand! Primary School English Teacher needed in Chumphon, #Thailand, Up to 35000THB per m #hiring Click to apply: https://t.co/VxyoAhp34Q;7/29/2019 21:05;0;;;;;;;;;
of;1.15595E+18;"*@dsquintana *@lobrowR Here is the ""way to early review"" I wrote for an invited issue last year that summarizes some of the p8 significance. https://t.co/tAtVjqFCDy
Long story short: It seems to matter only a little, if at all.";7/29/2019 21:05;0;;;;;;;;;
of;1.15595E+18;Study on carbon-induced signal enhancement in inductively coupled plasma mass spectrometry: an approach from the spatial distribution of analyte signal intensities https://t.co/zglgKQfkY7 #jaas #MassSpecPub #AtomicSpec;7/29/2019 21:05;0;;;;;;;;;
of;1.15595E+18;*@NabilaKhawaja *@Shaheer_S *@ShaheerBirdieFC Haha di😂 Just reminded me of our last convo🙈🙊🙊 Can we share him? Afterall sharing is caring🙈 #ShaheerSheikh;7/29/2019 21:05;0;;;;;;;;;
of;1.15595E+18;*@ESC_Journals *@escardio *@GeraldMaurer Interesting findings. Hate to knit-pick (don’t have access to full text) but why was regression multiple adjusted? Didn’t the propensity score matching take care of the baseline imbalance? If not, maybe need to re-think the #propensity model.;7/29/2019 21:05;0;;;;;;;;;
of;1.15595E+18;If you don’t get lit to this song then idk what type of Hispanic you are lol https://t.co/fGbA6QD7aU;7/29/2019 21:05;0;;;;;;;;;
of;1.15595E+18;"Twitter   Can't stand new site design. It SUCKS. DO NOT care if a woman team did this. Not user friendly for right-handed people. Tried of looking for logout, photos in wrong place. Suggested follows needs to go. Btw, site redesign should be user tested 1st  
*@Twitter *@TwitterAPI";7/29/2019 21:05;0;;;;;;;;;
of;1.15595E+18;"I *FINALLY* BEAT Abixjunior in a 1v1!

VENGEANCE IS MINE! Watch me rise beyond my pleb level skills and defeat the mighty *@AbixRL .  One of my favorite series to film! SO MUCH FUN!

https://t.co/nP0Pjkpsx4

#RocketLeague https://t.co/p5CHbLH4k7";7/29/2019 21:05;0;;;;;;;;;
of;1.15595E+18;I’ll be out of Indiana in a year. Speaking it into existence. I don’t belong here.;7/29/2019 21:05;0;;;;;;;;;
of;1.15595E+18;So tired of seeing ass everywhere.;7/29/2019 21:05;0;;;;;;;;;
of;1.15595E+18;*@Wendys *@HarMarSuperstar I am very offended this was not brought to my attention sooner. Using my likeness without permission and scheduling it far away, so I cannot even show up. This is the last straw, Wendy's. I have no choice, but to purchase a Baconator and enjoy the 950 calories &amp  60g of protein.;7/29/2019 21:05;0;;;;;;;;;
of;1.15595E+18;*@DonaldJTrumpJr Doesn't he told a lot of money to the IRS? Is anything being done about that?;7/29/2019 21:05;0;;;;;;;;;
of;1.15595E+18;Out at McArthur for the first day of fall practice. The Mustangs feature Maryland commit Ruben Hyppolite at linebacker, Rutgers commit Jerrold Pough at DB and more talented players. https://t.co/ZKq3UzwvkL;7/29/2019 21:05;0;;;;;;;;;
of;1.15595E+18;The UK contingent teamed up with *@cusco2cusco over the weekend, chalking up another 30 hours of invaluable ocean rowing experience and comparing notes on bucket techniques #ambitionoarnothing #crosstraining… https://t.co/eBDMNQPTwx;7/29/2019 21:05;0;51.63290836,0.84925658;0.84925658,51.63290836;3bc1b6cfd27ef7f6;0.4878546189233613,52.220450544867006;United Kingdom;GB;East, England;East;admin
of;1.15595E+18;*@triptychseok i’m gna go to bring the seoul movie premiere here in sweden with a group of friends and i’m so excited yet nervous sjshsjjs i’ve bought two packets of tissues just in case yk;7/29/2019 21:05;0;;;;;;;;;
of;1.15595E+18;*@Julie_foxy what is the point of this sl? i just don't get it...if she isn't scamming anyone, its a massive disappointment.;7/29/2019 21:05;0;;;;;;;;;
of;1.15595E+18;summer’s have always been stressful on ya girl - the feels of cancer season to my relationship season to my intimacy right after that 🥵;7/29/2019 21:05;0;;;;;;;;;
of;1.15595E+18;Might of only slept 12 hours total the past 3 days but last minute trip down to South Florida was a blast. *@ Jupiter, Florida https://t.co/vgQxc7FO7A;7/29/2019 21:05;0;26.926,-80.105;-80.105,26.926;b76db10a4d307c60;-80.1179956166269,26.931496000000003;United States;US;Jupiter, FL;Jupiter;city
of;1.15595E+18;"*@jonsnowC4 How could we possibly agree to a deal then when we had no idea of what we'd be offered.
Why did the remain MP's not have that added to A50 &amp  WA before they signed it. Did they not read what they were signing? Seemingly not!";7/29/2019 21:05;0;;;;;;;;;
of;1.15595E+18;*@VP *@WhiteHouse *@realDonaldTrump So glad to see this administration recognize the solution to our problems must include God. Repentence and regeneration of the individual first and then the families and from there the community. #FaithFirst #JesusDestroysTheDevilsWork #StrengthenFamilies;7/29/2019 21:05;0;;;;;;;;;
of;1.15595E+18;*@livanis_m *@Alyssa_Milano *@POTUS Or move out of the country. I prefer my option;7/29/2019 21:05;0;;;;;;;;;
of;1.15595E+18;*@ShaunWinfield Hello Shaun, we would be more than happy to assist you today. Would you be willing to provide us with the store location of the Circle K you visited, a brief summary of the incident and your contact information so we can have someone from our Management team reach out?;7/29/2019 21:05;0;;;;;;;;;
of;1.15595E+18;i know this is cringy but if my crush would tell me what nct say in the english ver of Highway of Heaven..... they like had me lmao;7/29/2019 21:05;0;;;;;;;;;
of;1.15595E+18;"Raised $3,000 for St. Jude through Charity Recovs!

...which means we've had a lot of people signed up LOL

The best duo is live finishing off as many as we can.

!Squad

https://t.co/cs5UDeEB4u";7/29/2019 21:05;0;;;;;;;;;
of;1.15595E+18;A thread. Imagine this woman's predicament: *@JetBlue lost her only way of getting around, her wheelchair. For. Seven. Hours. It's a disgrace. Shame on you #JetBlue https://t.co/U8ESP1JX0K;7/29/2019 21:05;0;;;;;;;;;
of;1.15595E+18;*@IlhanMN Says the most hate filled member of Congress. #SMH;7/29/2019 21:05;0;;;;;;;;;
of;1.15595E+18;uhhhhhh the AT&amp T WatchTV app has unreleased episodes of a bunch of CN shows on OnDemand 👀;7/29/2019 21:05;0;;;;;;;;;
of;1.15595E+18;"*@morningmika The liberal establishment and Democrat party loves black Americans, on average, about once every two years - on election day. The rest of the time, they don't give two cents about black Americans. You might as well be invisible  as in Chicago ~
https://t.co/pYPfdWLryK";7/29/2019 21:05;0;;;;;;;;;
of;1.15595E+18;what did the pi kappa phi pledge class of 1986 do to deserve this :/ https://t.co/t3YEiVJdfv;7/29/2019 21:05;0;;;;;;;;;
of;1.15595E+18;This week's *@KwaussieSport podcast is up... *@benkimber thinks *@AllBlacks are a class above *@qantaswallabies and *@nickystyris tees off against the #NRL refs! Plus *@scottbstyris makes a cameo appearance from his kitchen! *@NZWarriors Listen here &gt &gt  https://t.co/gU4ZT5TMja;7/29/2019 21:05;0;;;;;;;;;
of;1.15595E+18;Finished all 3 seasons of Travelers on *@netflix. Love it! Now in a #showhole;7/29/2019 21:05;0;;;;;;;;;
of;1.15595E+18;Story of my life https://t.co/nEUKyGzo68;7/29/2019 21:05;0;;;3134f9d2892d2685;-118.34411655017914,33.914068;United States;US;Hawthorne, CA;Hawthorne;city
of;1.15595E+18;you know who im talking about. but do you really? do any of us?;7/29/2019 21:05;0;;;;;;;;;
of;1.15595E+18;⁦*@SamsClub⁩ can you please bring back. One of my favorites and no notice gone. Why?!?! https://t.co/7mhqtitXmb;7/29/2019 21:05;0;;;;;;;;;
of;1.15595E+18;like the insecurity is kinda funny if u get that mad over what one person thinks and then have to go on making a spam of exo hate tweets like...go outside get some air drink some water whatever u need to do to understand twitter is never that serious;7/29/2019 21:05;0;;;;;;;;;
of;1.15595E+18;*@TJ30430 *@LiamPaulCanning What world class player wants to leave to come play for United? If United wanted Pepe they would of got him, I think they would prefer Sancho, who I think would come United next season if we got CL;7/29/2019 21:05;0;;;;;;;;;
of;1.15595E+18;I see many ways i wont see a drop of rain (nevermind thunder) https://t.co/bo4erZ693B;7/29/2019 21:05;0;;;cd450c94084cbf9b;-71.41213843044102,42.03693905;United States;US;Massachusetts, USA;Massachusetts;admin
of;1.15595E+18;You're all forgetting the fact that Katie is a 17 year old girl. 17 year old girls make mistakes and say things they don't mean, it's a shame Katie has to make mistakes in front of 2400 people. You all need to get a grip. *@ktcaIs 💜;7/29/2019 21:05;0;;;;;;;;;
of;1.15595E+18;Like I'm almost mad FOR other people haha cos truama really has made it so the only ways of accountability I know is saying the thing you did, then partaking in extreme public acts of self harm to show you're 'Sorry' but like.... Ain't no one wanting that lol;7/29/2019 21:05;0;;;;;;;;;
of;1.15595E+18;*@KamalaHarris *@TheRevAl Al is a con and liar.  It’s sad Kamala that you approve of his ways. Please study Al more as he is a racist and someone I won’t back or trust.;7/29/2019 21:05;0;;;;;;;;;
of;1.15595E+18;"Correction: low CO2 sources (it includes nukes, excludes biomass) as a percent of total energy consumption.
The US has abundant hydro, wind, solar, and geothermal. That last one is criminally underused.";7/29/2019 21:05;0;;;;;;;;;
of;1.15595E+18;*@oryceropodidian It's a bit too selective, they fund only research within certain groups of research that are already pre-approved and so on, chances too slim. But certainly would be lovely to go to Leiden or Ams, very good schools.;7/29/2019 21:05;0;;;;;;;;;
of;1.15595E+18;"Most grateful cheerfulness, as if, till this encouragement of something going to make it was not been darker.""";7/29/2019 21:05;0;;;;;;;;;
of;1.15595E+18;*@TinyChurchMouse *@ssmurf1968 *@PaulRebuked *@FrNajim Reminds me of the Wright brothers father who declared, if God wanted us to fly he would have given us wings, their response, He didn’t give us wings but the brains to learn how. You have free will and an intellect for a reason, use them both!;7/29/2019 21:05;0;;;;;;;;;
of;1.15595E+18;*@tombrittney You deserve your sweet tweets based on the last series,going forward please make it just as sweet-well not that sweet-bit of an edge somewhere....will be watching#nopressure,,,;7/29/2019 21:05;0;;;;;;;;;
of;1.15595E+18;No wonder you brick people Kanti you once owned a brick of a phone 🤣🤣😂🤣 https://t.co/DNDGwwNjOC;7/29/2019 21:05;0;;;;;;;;;
of;1.15595E+18;*@exiledbravesfan eugh. i remember seeing a poll on twitter last year that asked how people ate their steak. 70% of the 30k people picked options other than medium rare;7/29/2019 21:05;0;;;;;;;;;
