category;tweet_id;text;date;retweet_count;geo;coordinates;place_id;place_centroid;place_country;place_country_code;place_full_name;place_name;place_type
to;1.15595E+18;How old were you when you lost your virginity? Was your first time as special as everyone hypes it up to be?;7/29/2019 21:06;0;;;3b77caf94bfc81fe;-118.28758739336635,34.0207895;United States;US;Los Angeles, CA;Los Angeles;city
to;1.15595E+18;he already said that in their new house if the room will be too cold for her or the AC will be too loud he'll just sleep in the living room/office and i cant even imagine how he manages to live with someone who feels temperatures so differently..;7/29/2019 21:06;0;;;;;;;;;
to;1.15595E+18;"Earlier they changed the sign to read Gina Fischer.
I think they are #DIA #interrogators dealing with all the #rogue #CIA #arrested in #Gina's #fishing operation.
And the new picture says:
We are IE ABOARD
Because they are #Irish #Intelligence officers.
#QAnon #WWG1WGA #QNN #MAGA https://t.co/zux2KMLM0o https://t.co/K90qDhT2og";7/29/2019 21:06;1;;;;;;;;;
to;1.15595E+18;"“To get the full value of joy you must have someone to divide it with.”
– Mark Twain";7/29/2019 21:06;0;;;;;;;;;
to;1.15595E+18;Team Lakewood 🌶spicing🌶 it up on SAW Week! Associates ready to learn and share our services with our customers. *@Lord19Brian leading by example and inspiring the team! #SAWWEEK #TEAMLAKEWOOD *@OrmondLsormond *@PaulKellyTHD *@SHIRLEYBARAONA *@THDSpecialtyOps https://t.co/euNmYbG6Eg;7/29/2019 21:06;0;;;;;;;;;
to;1.15595E+18;"*@tobystyke74 Brilliant. The police really had there work cut out, did they bring in a eye specialist 😂 
Now the reality that there will be ""No charge"" 
Anything to not rock the boat of community multiculturalism";7/29/2019 21:06;1;;;;;;;;;
to;1.15595E+18;*@mommafoxfire *@CrankageGames So far The Witcher 3. I have spent 151 hours so far in the game on stream only! I have finally made it to the Blood and Wine DLC and i am going to be sad when i leave this game!;7/29/2019 21:06;0;;;;;;;;;
to;1.15595E+18;*@psychdr100 *@JulieA77669619 *@HuffPostPol Send all these disgusting POS’s to jail so they can appreciate their freedom.  Could pick out their favourite cell as well.  Besides, right now America is not far away from a draconian dictatorship;7/29/2019 21:06;0;;;;;;;;;
to;1.15595E+18;*@MrArsenicTM The defense need to be attend to because is the team main cause of concern.;7/29/2019 21:06;0;;;;;;;;;
to;1.15595E+18;"*@AboveTheBurgh *@ONLYPICKLES111 *@malgratz11 *@SCOTTDHELTON *@PrimeCreator2 *@tee10202 *@HeARTofGod99 *@kerrijacobi *@dtrastikeville *@Helicallight21 *@murphy991776 *@FlaRhps *@kbhnelson *@FBI *@USMC *@USNavy *@CIA *@Schmosephine *@FCC *@realDonaldTrump *@NSAGov *@GeishaJin *@RarnToGoHome *@USArmy *@usairforce *@DeptofDefense *@MarkFarn72 *@GenFlynn *@JamesGunn *@RealJamesWoods *@John_Qanon *@tomhanks *@Eminem *@FortBenning *@SecretService *@seanhannity *@TuckerCarlson *@TRADOC *@FLOTUS *@KidRock *@VP *@50cent *@samdernbach *@IAndrewMurray *@GM062616 *@LTCMim *@kanyewest *@KimKardashian *@RobLowe *@LouDobbs Going to have a tiny desk concert in the KY micro shortly
5[]6
11 https://t.co/XWbzZoSphC";7/29/2019 21:06;5;;;;;;;;;
to;1.15595E+18;*@ballsy72 Ya if Toronto had an offense .....BC would be in a league of their own right now......but the riders need to keep things simple and make up some ground post labour day;7/29/2019 21:06;0;;;;;;;;;
to;1.15595E+18;*@hindmezaina I fear the same might happen in the UK. No distribution yet that I've seen. Bad. And a pity, as I feel like it could be quite an easy film to trick people into seeing (erm, I mean market really vigorously!) - big, hip, attractive young cast, most of them playing musicians, etc.;7/29/2019 21:06;0;;;;;;;;;
to;1.15595E+18;*@davidmn316 *@reformedACE well. May God bless you and provide answers to all your questions through the study of His Word, through prayer, and through godly men of the Word, and may He provide rest for your mind and soul, b/c to live in this world w/ even the slightest fear that you could do something to&gt ;7/29/2019 21:06;0;;;;;;;;;
to;1.15595E+18;to boladona tmnc;7/29/2019 21:06;0;;;;;;;;;
to;1.15595E+18;*@turfnsport These days, I spend half my life sharing political memes, but at least I'm getting back into handicapping after a long hiatus to help curb my stress!  🏇😁 https://t.co/cbSKcn6QD7;7/29/2019 21:06;0;;;;;;;;;
to;1.15595E+18;*@ancientlyric *@ryanfb Where can I find one!! It will prove to be extremely useful!!!!!🤔🤓😉😁⚡🌀🔱;7/29/2019 21:06;0;;;;;;;;;
to;1.15595E+18;Let’s all work to the bone!! It’s been getting hectic in preparation for the festival, so I’d be glad if Kaoru-san would be willing to lend a hand too.;7/29/2019 21:06;0;;;;;;;;;
to;1.15595E+18;"*@Ediomo63676039 *@zen_barbi 😂khaffi has it coming. She can like Gedoni and still give him space and he wont be offended.

It's this way because Men hardly say no to a woman, because they don't want drama. Women are usually more in control in terms of defining personal space. 
She doesn't want space.";7/29/2019 21:06;0;;;;;;;;;
to;1.15595E+18;"Nobody:

Smash in game tutorial:
The best way to grab is by pressing shield and Z";7/29/2019 21:06;0;;;;;;;;;
to;1.15595E+18;I got this a couple of times when trying to experience lucid dreams https://t.co/RH03hwIiPZ;7/29/2019 21:06;0;;;;;;;;;
to;1.15595E+18;"*@realDonaldTrump The tragedy of this world right now is you. We can't get rid of you easily and we have to live with all your  bad choices, ignorant words, bigoted remarks and put downs of people who speak the truth about you. 
I really hope all these investigations uncover all your  crimes!!";7/29/2019 21:06;0;;;;;;;;;
to;1.15595E+18;"Everyone's putting mobile wallpapers either their memories with someone or encouraging words like ""You can"" ""Everything's going to be fine”but when we talk about me that's my message of encouragement to myself because I'm always a positive person lol😂 https://t.co/JNK9rfVOoP";7/29/2019 21:06;0;;;;;;;;;
to;1.15595E+18;Would like to thank again all those that followed me/ followed back. Premier league action is fast approaching. Come on you Spurs #thfc #tottenham #N17 #follow https://t.co/w1BjehIwpI;7/29/2019 21:06;0;;;;;;;;;
to;1.15595E+18;*@mommafoxfire *@CrankageGames Oh god i don't even know how many hours i've spent in runescape. as a kid.. has to be THOUSANDS lol.;7/29/2019 21:06;0;;;;;;;;;
to;1.15595E+18;*@Crissytina22 Other than that, I personally am not offended by it. It gives me people to follow, support and to build a connection with over similar tastes in games. Then we lurk and talk with each other in our streams. I’ve met cool people this way and we support each other! :);7/29/2019 21:06;0;;;;;;;;;
to;1.15595E+18;*@NoCappinn *@TheGreatChap *@iOnceWasGood *@_Sokrr *@AzureSJE *@xTeezo *@Kae9ine_ Oh nice me trying to play a go4 with you you really exposed me there 😂still made it farther than you, fuck up you’ll stay loosing;7/29/2019 21:06;0;;;;;;;;;
to;1.15595E+18;That song resonated to me...deep https://t.co/MsINh5QGbf;7/29/2019 21:06;0;;;;;;;;;
to;1.15595E+18;*@brassoteach *@Mr_AlmondED That sometimes a lack of engagement can be a child's fault. If they don't choose to engage (not because they don't get it but because they don't want to) then there's a responsibility on the child.;7/29/2019 21:06;0;;;;;;;;;
to;1.15595E+18;"With small changes to his stance and bat grip, Andy Weber has been on a tear. The #Cubs prospect one-upped his Sunday performance with another career day for *@SBCubs.

📰: https://t.co/2v6HvDFvvx https://t.co/LZRYwDLNOk";7/29/2019 21:06;5;;;;;;;;;
to;1.15595E+18;"*@ultrxlana *@tiatokhadijah I think that is the reason why I have seen so many reverts that are Shi'a now within university and on twitter due to the approach of them explaining the religion.

When I think about it, a black, white or asian non Muslim will not learn about Islam or convert if you...";7/29/2019 21:06;0;;;;;;;;;
to;1.15595E+18;#loveIslandfinal India will dump him &amp  his hats soon .. there is no chemistry there at all .. He is way to nice for her ..;7/29/2019 21:06;0;;;;;;;;;
to;1.15595E+18;*@neveen_beydoun he told me to kill myself in another msg 🙈;7/29/2019 21:06;0;;;;;;;;;
to;1.15595E+18;Daily reminder that #MoscowMitch has another number you can call (seen at the end of this video), and you can call him and tell him America can make its own aluminum plants. Tell him to protect the elections and also remind him that we know about his self-dealing wife. https://t.co/uEm5A5FzJZ;7/29/2019 21:06;0;;;;;;;;;
to;1.15595E+18;*@risingwindmill ANDJFHSJAKXHDD IM GOING TO FAZE YOU TO THE NEXT DIMENSION URI;7/29/2019 21:06;0;;;;;;;;;
to;1.15595E+18;dannytrejo a real OG stepped into cannonsclasstv to drop some real gems ✊🏾 https://t.co/0tZQqPgmhR;7/29/2019 21:06;3;;;;;;;;;
to;1.15595E+18;I’m posting my nudes if amber &amp  Greg win, that’s how impossible it is because it’s never going to happen;7/29/2019 21:06;2;;;;;;;;;
to;1.15595E+18;To be fair I’d only gonna ask if I suspect though not all the damn time like a damn police officer.;7/29/2019 21:06;0;;;18810aa5b43e76c7;-96.7301749064317,32.819858499999995;United States;US;Dallas, TX;Dallas;city
to;1.15595E+18;I worked hard to make this outfit for the festival, but I was in a bit of a rush. Does it look like I got it right?;7/29/2019 21:06;0;;;;;;;;;
to;1.15595E+18;"*@sakadoboys1 結果は動画で確認！🧐
当選された方には、DMでギフト券コードをお届けします。

✨「EJアーカイブス」シリーズを、ぜひご覧ください✨
➡https://t.co/wtNRL5ci01 https://t.co/CKiBkOxvIP";7/29/2019 21:06;0;;;;;;;;;
to;1.15595E+18;Eu não tô bem 😥;7/29/2019 21:06;0;;;;;;;;;
to;1.15595E+18;eu tô tão ansiosa que nem consigo comer nadaa;7/29/2019 21:06;0;;;c83a3bc35870a7a1;-46.29112086494987,-23.86332;Brazil;BR;Santos, Brasil;Santos;city
to;1.15595E+18;*@ImKnotTheOne *@realDonaldTrump What makes you perfect? To jugde another human being;7/29/2019 21:06;0;;;;;;;;;
to;1.15595E+18;*@call_me_gaff *@_mohmusa_ *@MuhammadThani_ 🤧🤧why;7/29/2019 21:06;1;;;;;;;;;
to;1.15595E+18;"looks on the right and sees dimitri.
looks on the left and sees claude.
looks in front of me and sees edelgard.

me: how am i even suppose to take part into this war if i have these hot visions at my sides ?????";7/29/2019 21:06;0;;;;;;;;;
to;1.15595E+18;*@ChippyBurnett I’m honestly a little scared to get back into serious streaming after this week-long reprieve, but that’s how I know I need to do it.;7/29/2019 21:06;0;;;;;;;;;
to;1.15595E+18;*@Bradley13morris *@JaydenGilliamS1 ya’ll gotta watch some of these clips. These are the things that will take your game to the next level. https://t.co/2K5cQlXIzL;7/29/2019 21:06;0;;;;;;;;;
to;1.15595E+18;#LoveIsland this year has been pretty disappointing and nothing compared to the previous years. But obviously I’ve been glued to it everyday. However, I genuinely don’t think any of these couples are deserving winners🧐 give the money to charity, or just give it all to #ovie;7/29/2019 21:06;0;;;;;;;;;
to;1.15595E+18;Unexpected interactions within the bay we call home. #montereybay #csumb *@CityofMonterey #whales #sealion #oceans https://t.co/BNZ9hVWlMe;7/29/2019 21:06;0;;;89bac4213b1b5525;-121.82798777704562,36.6258064;United States;US;Seaside, CA;Seaside;city
to;1.15595E+18;*@orrisdead yeah the archer isn’t love at first sight with me, i’ll have to wait it out;7/29/2019 21:06;0;;;;;;;;;
to;1.15595E+18;tô saindo do serviço agora;7/29/2019 21:06;0;;;;;;;;;
to;1.15595E+18;Minneapolis Area REALTORS® has extensively reviewed two proposed Minneapolis ordinance drafts regarding rental properties and has sent comment letters to the Mayor, Minneapolis City Council, and key city staff.  https://t.co/XvNEVRyx5m;7/29/2019 21:06;0;;;;;;;;;
to;1.15595E+18;*@KamalaHarris You’ve said you’re going to do so many things.   No politician gets that many done.   What’s really important to you?  Those are the policies that I want to know before I decide who to vote for.;7/29/2019 21:06;0;;;;;;;;;
to;1.15595E+18;*@GreatGameIndia *@BearGrylls *@narendramodi *@DiscoveryIN The terrorist attack happened after shoot was over.  Modi flew back to Delhi and gave reply in Balakot.  Unlike the previous lame ducks who could only spout spirit of Mumbai when ordinary citizens died in 26/11.  Btw, sun was also rising in east that day.;7/29/2019 21:06;0;;;;;;;;;
to;1.15595E+18;"群抜きで
大学受験を蹴ったことやろな 

#peing #質問箱 https://t.co/TNdK6jQoTD";7/29/2019 21:06;0;;;;;;;;;
to;1.15595E+18;"*@WilliamAEstes *@AOC I marvel at your insight into this particular strategy of AOC/Progressives, as a camouflaged method to avoid substantive conversation, or even to attack.
I thought it was merely another effort to confuse &amp  anger, disguised as righteous promotion of poor people and/or the climate.";7/29/2019 21:06;0;;;;;;;;;
to;1.15595E+18;ai gente to quase dropando bts world pq n consigo passar daquele 6-1 q drogaaaaaaaa;7/29/2019 21:06;0;;;;;;;;;
to;1.15595E+18;"Just as my evening DJ set began to kick off.

I was playing some real floor grabbers, per say.

This one is a bootleg by Mr Carmack. Check it out on SoundCloud - ‘Shimmy Shimmy Ya’

I was so thrilled to be DJing in… https://t.co/gRlALf7esl";7/29/2019 21:06;0;;;;;;;;;
to;1.15595E+18;Thirty-seven percent of employers have relaxed job requirements for temporary workers to compete for talent! Read more about this trend here! https://t.co/vC3MzLdBE6 https://t.co/aoMI0GeaZO;7/29/2019 21:06;0;;;;;;;;;
to;1.15595E+18;How does he sleep at night? Momma, the nerve of this guy to leave me so easy🎼;7/29/2019 21:06;0;;;;;;;;;
to;1.15595E+18;*@king_val3ntin3 Wow sounds messy, I watched s1 of the amome but didn't want to continue with it 😅;7/29/2019 21:06;0;;;;;;;;;
to;1.15595E+18;Amber and Greg to win! Please! 💕💕💕💕💕💕💕💕💕💕💕💕💕💕 #loveisland;7/29/2019 21:06;0;;;;;;;;;
to;1.15595E+18;*@paradox_la *@i_Jane_Doe *@FortCupDeals *@itsDylanW24 *@TheFlashHayden Oh apologise for not replying to your needy ass straight away, it’s nice to know you’re already so obsessed with me ☺️ keep in mind people have other things to do and actually relevant people to reply to;7/29/2019 21:06;0;;;;;;;;;
to;1.15595E+18;"Please take me by the hand
It's so cold out tonight, I'll
Put blankets on the bed
I won't turn out the light, just
Don't forget to think about me and I
Won't forget you
""I'll write you once a week, "" she said
Why does it feel the same
To fall in love or break it off🎶";7/29/2019 21:06;0;;;;;;;;;
to;1.15595E+18;y'all pls pray for my and my roommates to your various deities bc we are trying to fight our landlord company and I am STRESSED;7/29/2019 21:06;0;;;;;;;;;
to;1.15595E+18;*@BauerOutage Sorry to bring up an old thread, but I don't see how this is a thing when the camera angle is directly behind the mound at this field. Def weird that the righty pitch starts on 1b side but a rh slider from 3b side should look just as nasty from straight behind as an lh slider;7/29/2019 21:06;0;;;;;;;;;
to;1.15595E+18;Love is a bird she needs to fly 🕊;7/29/2019 21:06;0;;;;;;;;;
to;1.15595E+18;*@pangurdubh3 It was one of about 10 cassettes I took with me on my 6 months in France in 1970-80. I listened to it over &amp  over. There aren’t many albums I know better.;7/29/2019 21:06;0;;;;;;;;;
to;1.15595E+18;*@RussoRr054 *@rmack2x *@emmick66 *@VBeltiz You're absolutely right.  There are those who prefer to live in the welfare state - either they have no skills or don't want to work.  They expect the government to take care of them.;7/29/2019 21:06;0;;;;;;;;;
to;1.15595E+18;A może by tak rzucić to wszystko i zostać hodowcą królików?;7/29/2019 21:06;1;;;;;;;;;
to;1.15595E+18;*@embeessem *@rhonda_harbison *@glennkirschner2 I’m only confident bcz it seems like over half the govt jobs haven’t been filled, many have zero qualifications for what they’re doing &amp  others are heading departments they hate &amp  want to destroy (like a coal baron as head of the EPA axing all the regulations).  Can it last?  🤷🏻‍♀️;7/29/2019 21:06;0;;;;;;;;;
to;1.15595E+18;idc what y’all gotta say cuz u ain’t ever gonna say it to my face 😂😂😂😂 fckn clowns. show up or stfu lol;7/29/2019 21:06;0;;;;;;;;;
to;1.15595E+18;*@Glasgows_girl I don't want my taxi driver to fiddle the meter. But no driving licence...;7/29/2019 21:06;0;;;;;;;;;
to;1.15595E+18;I hope you are next to me very much, because my time with you is so  beautiful;7/29/2019 21:06;0;;;;;;;;;
to;1.15595E+18;i also sleep with a fan on and still literally wake up super sweaty bc of the heat so i cant even imagine how he felt having to sleep with no fan at all   ;7/29/2019 21:06;0;;;;;;;;;
to;1.15595E+18;*@kjnstyles i have high hopes but also am prepared to be disappointed 😔;7/29/2019 21:06;0;;;;;;;;;
to;1.15595E+18;I am not someone you should be following if your immediate response to scientific polling numbers is “That can’t be right! Fake news!” If there’s a bad polling number for my candidate, I brainstorm for ways they can improve. I don’t write off the poll as a hoax.;7/29/2019 21:06;2;;;;;;;;;
to;1.15595E+18;Gotta commit to the game sometime and that time is now! https://t.co/Pc1J0qjBjg;7/29/2019 21:06;2;;;;;;;;;
to;1.15595E+18;now i have to wait a whole two weeks before I see them again :(;7/29/2019 21:06;0;;;;;;;;;
to;1.15595E+18;*@jonlovett No-he gets closest to AC;7/29/2019 21:06;0;;;;;;;;;
to;1.15595E+18;"If that's what his angry looks like, I'm not feelin' it.  Somebody should poke him to make sure he's still alive.
#MitchMcConnell https://t.co/IGbYvE2BHz";7/29/2019 21:06;0;;;;;;;;;
to;1.15595E+18;*@MarianeSantosd9 Ah, tô em dia. Tá tranquilo 😅😅😅😅😅😅;7/29/2019 21:06;0;;;;;;;;;
to;1.15595E+18;"-Ovie and India look so comfortable together, they seem to have such natural chemistry
-I haven't even been watching the body language analysis / love Island videos on YouTube lmaoo 
-Ovie knows how to dress.
-India has been so under-appreciated
-Ovie has a level-head. I like.";7/29/2019 21:06;0;;;;;;;;;
to;1.15595E+18;*@Javashots Played Son-in-law to Archie Bunker;7/29/2019 21:06;0;;;;;;;;;
to;1.15595E+18;*@AnaLuizaSlv *@uebrisei *@elisannss não to sabendo lidar https://t.co/tofa6qu8sX;7/29/2019 21:06;0;;;;;;;;;
to;1.15595E+18;"(・ω・)

モザ無しの動画見たい人？
5名らぶりつくれたら
送るね

///
 #ソフトSM #会える人";7/29/2019 21:06;0;;;;;;;;;
to;1.15595E+18;"*@PamelaGeller Have you ever seen a more miserable group of people?

Even the Five Star Dining on our dime doesn’t seem to help.";7/29/2019 21:06;0;;;;;;;;;
to;1.15595E+18;*@AngrySaxon14 *@FOX2now They took it down immediately. The employee was fired. Is that so sweet to you?;7/29/2019 21:06;0;;;;;;;;;
to;1.15595E+18;*@chelleryn99 *@TheSun Jeremy Corbyn can't be everything the press says he is. It is like Calling a Dictator a Democrat you can't be both. So everyone knows that it just the same old Lies from a frightened Press and Media. Boris would be good as an after Dinner speaker but as PM not up to the job;7/29/2019 21:06;0;;;;;;;;;
to;1.15595E+18;I love you to the moon and back 💙;7/29/2019 21:06;0;;;;;;;;;
to;1.15595E+18;Poprosze to na urodzinki 🤞🤞🤞🤞🤞 https://t.co/sgtMHReSXT;7/29/2019 21:06;0;;;;;;;;;
to;1.15595E+18;They need to show V11s mxxxm;7/29/2019 21:06;0;;;;;;;;;
to;1.15595E+18;My paychecks each month when it’s time to pay bills https://t.co/Sj6vlKhOvW;7/29/2019 21:06;0;;;;;;;;;
to;1.15595E+18;"Ovie: She’s got a lot of levels and I’m looking forward to discovering #loveisland 

Viewers: https://t.co/A1NzKknetL";7/29/2019 21:06;8;;;;;;;;;
to;1.15595E+18;A car can be a deadly weapon.  There's no need to be weaving through other cars and cut people off.  You could hurt somebody. STOP BEING STUPID! unless.. your booty is about to explode out your lunch and you rushing to a toilet in which case I'll say carry on.;7/29/2019 21:06;0;;;1d9a5370a355ab0c;-87.67181069718896,41.833584450000004;United States;US;Chicago, IL;Chicago;city
to;1.15595E+18;#DASHdiet reduces #heartfailure risk, according to researchers from *@wakehealth: https://t.co/RUsadIl0ny #primarycare #medtwitter #seniorcare #eldercare #DASH https://t.co/Q27Y8JgU32;7/29/2019 21:06;0;;;;;;;;;
to;1.15595E+18;These are the first nails I ever did almost a year ago, no school, I didn't even know the correct products to use! Picture 2 is a picture of my recreation of the nails recently, still no school but I'm getting their soon!! #nails #nailart #nail #naildesigns #cosmetology #nailsart https://t.co/3vv1H58qOD;7/29/2019 21:06;0;;;;;;;;;
to;1.15595E+18;Tô quase pra nem eu ir pra essa cerimônia pq assim tem convite pra TD mundo q eles querem levar nesse crlh;7/29/2019 21:06;0;;;;;;;;;
to;1.15595E+18;*@guineung Even better: the ability to make ANY boy a dancer;7/29/2019 21:06;0;;;;;;;;;
to;1.15595E+18;I love to hide Sweden's slippers every morning. This is a secret though! ´ﾟωﾟ `;7/29/2019 21:06;0;;;;;;;;;
to;1.15595E+18;*@WNTTgra So it isn’t a parody account? It’s getting very hard to tell...;7/29/2019 21:06;0;;;;;;;;;
to;1.15595E+18;"#wisdom ""“It is open to every man to choose the direction of his striving,” he explained, “and every man may take... https://t.co/E43hcGLIaz";7/29/2019 21:06;0;;;;;;;;;
to;1.15595E+18;*@j_bertolotti *@daniel_bilar *@MathCitadel Rachel is much more qualified to expand on this one, but you can roughly think of the Poisson distribution as the law of sparse events. I first learned about it in the context of modelling cargo vessel calls at a port where it works reasonably well.;7/29/2019 21:06;0;;;;;;;;;
to;1.15595E+18;looking to try out for a potential 2k20 team. Plan on making Glass Cleaner or Potential Primary Rebounder. Have a 92 Post Scoring Rebounder right now on 2k18 (PS4). *@FindComp *@2KCrewFinder *@Big_Brudda_PURP;7/29/2019 21:06;1;;;;;;;;;
to;1.15595E+18;Tomar um banho e tirar um cochilo to caindo de sono já 🤦🏻‍♂️;7/29/2019 21:06;0;;;;;;;;;
to;1.15595E+18;*@rickygervais Hi there my name is Thomas Phillips I have a best friend callled Jadon Carnelly Morris I am a stand up comedian and want to work on a comedy project with him but I would as a huge fan of the dvd of the podcast I want you to write it if I direct it my email address;7/29/2019 21:06;0;;;;;;;;;
to;1.15595E+18;"*@davers33 *@JanniraGuirado *@ElisaMA188 The sentence is correct if you say: ""You know THAT I started to learn English...""
And ""that"" is optional, you can omit it. But ""You know WHAT I started to learn English..."" is incorrect.";7/29/2019 21:06;0;;;;;;;;;
to;1.15595E+18;"Pay attention to language:

• patriotism before politics
• Nazi
• Dictator
• Lawless 
• Fascist
• no one is above the law

The left needs to paint Trump as a tyrant in an attempt to avoid accountability/prosecution for Obama-era abuses about to be exposed by IG/Barr. https://t.co/6oDIxgQGcF";7/29/2019 21:06;16;;;;;;;;;
to;1.15595E+18;"*@Lovleeesazy Holy crap I would die😭😱
it’s impossible for me to get a high-end foundation, as bad as I would love to, we’ve got four different shades in my house and The cost would be astronomical, but I bet the finish is more beautiful than even I could imagine😍🤩🤪";7/29/2019 21:06;0;;;;;;;;;
to;1.15595E+18;*@ClaraJeffery He was there right next to NBC’s Brian Williams. #fiction;7/29/2019 21:06;0;;;;;;;;;
to;1.15595E+18;esse povo que namora pega mais gente que eu que tô solteira kkkkkkkkkkkk;7/29/2019 21:06;0;;;;;;;;;
to;1.15595E+18;*@DenbrotS *@gtownliberal But see the rich like to keep people uneducated or thinking that they could improve their situation.  Wonder why West Virginia and other Appalachia areas are overrun with opioids and heroin ?;7/29/2019 21:06;0;;;;;;;;;
to;1.15595E+18;to be fair, i forgot my meds and my catholic studies teacher would let us sleep during meditation;7/29/2019 21:06;0;;;;;;;;;
to;1.15595E+18;*@taylorswift_VT Guarantee you scoots going to use her like a pawn in a chess game over Taylor.. he wants control;7/29/2019 21:06;0;;;;;;;;;
to;1.15595E+18;fiz 30 min de bike do Senai até  cecap e to me sentindo maratonista, eu flo q eu sou boba;7/29/2019 21:06;0;;;;;;;;;
to;1.15595E+18;*@TiffanyAndLupus *@KIPP I am elated you enjoyed the panel. I was excited to talk about entrepreneurship and professional/development with these remarkable Women!!!!!;7/29/2019 21:06;0;;;;;;;;;
to;1.15595E+18;*@cbr600f4iny Thank you! I can confirm we have received your details. We'll be in touch with you as soon as this information has been reviewed. Please keep an eye on your spam/junk folders, as it isn't uncommon for our correspondence to get directed there. ^SL;7/29/2019 21:06;0;;;;;;;;;
to;1.15595E+18;*@_LittleIndian i felt this to the coreeeee😭😭;7/29/2019 21:06;1;;;;;;;;;
to;1.15595E+18;This is what fake news looks like kids. This was just a flat out lie, Aaron, idk who you think you're fooling (except yourself). What's even more sad is he has a (what is clearly now meaningless) blue check mark next to his name. https://t.co/Dmi0xL2gAG;7/29/2019 21:06;0;;;;;;;;;
to;1.15595E+18;"*@adamlewins1 *@MathiesonJay I’d pay serious coin to witness that....... as long as Hot Rod was loosing 😂😂
Back home tomorrow pal, Benno’s Been lovely *@MathiesonJay can’t wait to come back with us......";7/29/2019 21:06;0;;;;;;;;;
to;1.15595E+18;*@AOC WRONG! Your green new deal is designed to bankrupt the Country &amp  implement socialism.;7/29/2019 21:06;0;;;;;;;;;
